{"image":"https://example.org/oer/image.png","creator":[{"name":"HansD","type":"Person"}],"audience":[{"id":"http://purl.org/dcx/lrmi-vocabs/educationalAudienceRole/student"}],"about":[{"id":"https://w3id.org/kim/hochschulfaechersystematik/n059"}],"description":"Eine OER","inLanguage":["fr"],"mainEntityOfPage":[{"dateCreated":"2020-01-01","provider":{"name":"ZOERR","id":"https://oerworldmap.org/resource/urn:uuid:4062c64d-b0ac-4941-95c2-8116f137326d"},"dateModified":"2021-08-20","id":"https://api.hoerkaen.hbz-nrw.de/resource/oer:18","type":"Text"}],"type":["LearningResource"],"@context":["https://w3id.org/kim/lrmi-profile/draft/context.jsonld",{"@language":"de"}],"license":{"id":"https://creativecommons.org/publicdomain/zero/1.0/"},"dateCreated":"2019-07-03","name":"Beispielressource","publisher":[{"name":"Tutory","id":"https://www.tutory.de","type":"Organization"}],"id":"https://example.org/oer"}
