{"creator":[{"name":"Jens Lechtenbörger","id":"https://orcid.org/0000-0002-3064-147X","type":"Person"}],"audience":[{"inScheme":{"id":"http://purl.org/dcx/lrmi-vocabs/educationalAudienceRole/"},"prefLabel":{"en":"student"},"id":"http://purl.org/dcx/lrmi-vocabs/educationalAudienceRole/student","type":"Concept"}],"keywords":["Computer Science","Operation Systems","Computer Structures"],"hasPart":[{"name":"JiTT for OS","id":"https://oer.gitlab.io/OS/Operating-Systems-JiTT.html","type":["LearningResource","PresentationDigitalDocument"]},{"name":"OS Overview","id":"https://oer.gitlab.io/OS/Operating-Systems-Overview.html","type":["LearningResource","PresentationDigitalDocument"]},{"name":"OS Introduction","id":"https://oer.gitlab.io/OS/Operating-Systems-Introduction.html","type":["LearningResource","PresentationDigitalDocument"]},{"name":"OS02: Interrupts","id":"https://oer.gitlab.io/OS/Operating-Systems-Interrupts.html","type":["LearningResource","PresentationDigitalDocument"]},{"name":"OS08: Virtual Memory I","id":"https://oer.gitlab.io/OS/Operating-Systems-Memory-I.html","type":["LearningResource","PresentationDigitalDocument"]}],"about":[{"inScheme":{"id":"https://w3id.org/kim/hochschulfaechersystematik/scheme"},"prefLabel":{"de":"Informatik"},"id":"https://w3id.org/kim/hochschulfaechersystematik/n079","type":"Concept"}],"description":"A course on Operating Systems (following the book Operating Systems and Middleware: Supporting Controlled Interaction by Max Hailperin) as part of the module Computer Structures and Operating Systems for 4th-term students in the Bachelor program in Information Systems at the University of Münster, Germany.","inLanguage":["en"],"type":["LearningResource","Course"],"mainEntityOfPage":[{"dateCreated":"2021-08-20","id":"https://api.hoerkaen.hbz-nrw.de/resource/oer:19"}],"@context":["https://w3id.org/kim/lrmi-profile/draft/context.jsonld",{"@language":"de"}],"license":{"id":"https://creativecommons.org/licenses/by-sa/4.0/"},"name":"Computer Structures and Operating Systems","id":"https://oer.gitlab.io/OS"}
